Practice Makes Perfect,Narrow the opportunity gap.,Narrow the opportunity gap.,"Started as a student club at Cornell to provide summer enrichment for urban youth in NYC, now partners with K-12 schools to provide many programs including tutoring.","Tutoring Program, Technology Platform, Academic Intervention, Other","AIS, RTI, Tutoring, Push-ins, Pull-outs, After School, Saturday Academy, SAT prep, Summer Enrichment programs.","New York, New York",New York,https://practicemakesperfect.org/,For Profit,2010,"English Language Arts (ELA), Early Literacy, Math, Reading, Science, Social Studies, Other",All,"Pre-Kindergarten, Kindergarten, 1st Grade, 2nd Grade, 3rd Grade, 4th Grade, 5th Grade, 6th Grade, 7th Grade, 8th Grade, 9th Grade, 10th Grade, 11th Grade, 12th Grade, Post secondary","English, Spanish, Other",Arabic,"Tutoring staff, Other","We train college students, graduate students, and recent graduates in tutoring and intervention strategies.","In-Person, Virtual","100% speak English; 50% bilingual (English/Spanish, English/Arabic, English/Mandarin, English/Other)","Hispanic or Latino- 20%, Asian 20%, Black or African American 30%, White 25%",20000+,,,,1:1 up to 5:1,,"During School, Out of School",,"Surveys, weekly email outreach to parents soliciting quality of sessions, and frequent outreach from Interventionists/Tutors to parents.",Yes,Results not ye published (disrupted by COVID),,No,,,"Parent, School, Student","Varies; Avg. school contract is $45k; however, contracts range from $5k - $250k based on students served; Parent contracts for Private tutoring start at ~$200 per month for weekly services.",Free,
Reading Corps,"All children will become proficient readers by third grade, to have the skills they need to thrive in school and life.","All children will become proficient readers by third grade, to have the skills they need to thrive in school and life.","Reading Corps combines the people power of AmeriCorps and the science of how children learn to read. Trained AmeriCorps members are placed in early learning centers and elementary schools statewide to serve as literacy tutors for children from age 3 to grade 3. Tutors work with children one-on-one and in small groups daily, providing literacy interventions that are tailored to each learner's needs.

Affiliate Programs:  

Hope Network – Michigan Education Corps, Reading & Math, Inc., https://hopenetwork.org/michigan-education-corps/

The Literacy Lab, https://theliteracylab.org/

South East Education Cooperative (SEEC), https://www.ndreadingcorps.org/

Colorado Youth for a Change, https://youthforachange.org/join-americorps/join-americorps-colorado-re…

United Ways of Iowa, https://www.uwiowa.org/ReadingCorpsSchools","Tutoring Program, Other",Intensive reading tutoring.,"Minneapolis, Minnesota","California, Colorado, Florida, Iowa, Maryland, Massachusetts, Minnesota, Missouri, Virginia, Washington DC, Wisconsin",http://www.readingcorps.org/,Nonprofit,2003,Reading,,"Pre-Kindergarten, Kindergarten, 1st Grade, 2nd Grade, 3rd Grade",English,,Paraprofessional,,In-Person,"English only = 87%, Spanish = 8%, French = 2%, Somali = 1%, Hmong = 1%, German = 1%","Hispanic or Latino- 7 %, American Indian or Alaska Native 1%, Asian 5%, Black or African American 12%, White 73%",36000,20,5,16,1:01,,,,Program tutors send home literacy activities that complement and extend in-school tutoring activities.,Yes,"https://www.nationalservice.gov/sites/default/files/documents/Impact_Ev…, https://www.nationalservice.gov/sites/default/files/documents/03-2015_P…, https://1kvjxp28gemz2aa4gi2qmxxh-wpengine.netdna-ssl.com/wp-content/upl…, https://static1.squarespace.com/static/56df566af699bb94c7a3a189/t/5c37b…",,Yes,Not yet available.,,School,Free,Free,
Reading Partners,,Help children become lifelong readers by empowering communities to provide individualized instruction with measurable results.,"Evidence-based program that recruits, trains, and supports community volunteers to provide individualized reading instruction to K-4 students",Tutoring Program,,"Oakland, CA","California, Colorado, Maryland, Minnesota, New York, Oklahoma, South Carolina, Texas, Washington, Washington DC",http://www.readingpartners.org,Nonprofit,1999,Reading,,"Kindergarten, 1st Grade, 2nd Grade, 3rd Grade, 4th Grade",English,,Volunteer,,"In-Person, Virtual",,"""American Indian/Alaska Native: 1%  Asian: 13%  Black or African American: 10%  Hispanic or Latinx: 7%  Native Hawaiian/Other Pacific Islander: 0%  White: 64%  Other race: 1%  Two or more races: 4%  """,11000,45,2,30 sessions total,1:01,,"During School, Out of School",,"Family texting, student learning packets, family literacy resources and tips to use at home, family engagement workshops, family and community advisory groups to provide input into programming improvements",Yes,Mobilizing Volunteers Tutors to Improve Student Literacy (RCT by MDRC),0.1,Yes,Mile High United Way Social Innovation Fund evaluation of Reading Partners (QED by APA),0.14,"District, School","Cost varies by region. Typically $25,000 per reading center for up to 60 students.",Free,
Saga Education,"Saga Education serves historically under-served young people through personalized, consistent, caring and best-in-the-world tutorials that result in youth gaining confidence and academic strength so that they see, pursue and realize their grandest dreams.","Saga Education serves historically under-served young people through personalized, consistent, caring and best-in-the-world tutorials that result in youth gaining confidence and academic strength so that they see, pursue and realize their grandest dreams.","Saga embeds algebra (or geometry) math tutors as a class within the school day. Our tutor teams can serve 20-40 students per period, and the tutors can work in person or online. Tutors work in ratios of 1:2 to 1:4, and we offer four models.",Tutoring Program,,"Newton, Massachusetts","Florida, Massachusetts, New York, Washington DC",www.sagaeducation.org,Nonprofit,2014,"Math, Other",Focus on Algebra I,"9th Grade, 10th Grade",English,,,,"Blended, In-Person, Virtual",,,5000,40-60,5,,"2:1 (Saga Traditional), 3:1 (Saga Online), 4:1 (Saga Blended)",,During School,,"Our tutors contact homes at least monthly to build strong family relationships, and we share information with school teachers and admin to support our students.",Yes,https://www.nber.org/papers/w28531,,No,,,School,"Cost is per student depending on number of students, dosage, Americorps subsidy and philanthropy.",Free,
SPARK Early Literacy Tutors (Service Year),"Service Year Alliance is working to make a year of paid, full-time service — a service year — a common expectation and opportunity for all young Americans.","Service Year Alliance is working to make a year of paid, full-time service — a service year — a common expectation and opportunity for all young Americans.","SPARK Early Literacy provides in-school tutoring, family engagement, and opportunities to attend after-school activities to all students in high-poverty schools, not just to low achievers. SPARK Early Literacy tutors work with K5-3rd grade struggling readers, using a set lesson plan and program materials.","Tutoring Program, Academic Intervention",,"Milwaukee, Wisconsin",Wisconsin,https://serviceyear.org/boysgirlsclubs/spark-early-literacy-tutor/,Nonprofit,2006,Reading,,"Kindergarten, 1st Grade, 2nd Grade, 3rd Grade",English,,Paraprofessional,,"In-Person, Virtual",,"Black or African American 50%, White 50%",,30,3,,1:01,,During School,,"To execute the family engagement component, each site has a parent partner who works with participating studentsâ€™ families.",Yes,https://www.nationalservice.gov/sites/default/files/evidenceexchange/FR…,Mean effect size of +0.51,No,,,"Nonprofit, School",Free,Free,
Tutoring with the Lightning Squad,,,"Tutoring with the Lightning Squad is a peer-supported, web-based, interactive multimedia tutoring model. Developed by Sirius Thinking, Ltd., and the Success for All Foundation in collaboration with Sesame Workshop, the program is designed to enable struggling readers in Grades 1-3 to achieve grade-level literacy proficiency by developing skills in fluency, phonics, word blending, spelling, vocabulary and comprehension through a series of game-like cooperative activities.","Tutoring Program, Technology Platform",,"Baltimore, MD",,http://www.successforall.org/our-approach/targeted-programs/tutoring-with-the-l…,Nonprofit,2015,Reading,,"1st Grade, 2nd Grade, 3rd Grade",English,,Paraprofessional,,"In-Person, Virtual",,,,,,,6:01,,During School,,,Yes,https://www.tandfonline.com/doi/full/10.1080/10573569.2016.1255577,,,,,School,,,
Aggie Homework Helpline (AHH),,The mission of the AHH is to connect Texas families and school district partners with Aggie tutors and education interns who are committed to improving learning outcomes for PK-12 students.,"The Aggie Homework Helpline (AHH) is an initiative to help provide quality, free online tutoring to PK-12 learners and families.",Tutoring Program,,"College Station, Texas",Texas,https://education.tamu.edu/aggie-homework-helpline/,Nonprofit,,,,"Pre-Kindergarten, Kindergarten, 1st Grade, 2nd Grade, 3rd Grade, 4th Grade, 5th Grade, 6th Grade, 7th Grade, 8th Grade, 9th Grade, 10th Grade, 11th Grade, 12th Grade",,,,,,,,,,,,,,,,,,,,,,,,,,aghomeworkhelpline@tamu.edu
America Reads America Counts,,,"Tutors encourage students in the subject areas of Reading and Mathematics, and support children in their school development. Tutors work directly with kindergarten through sixth grade students to improve their reading and math proficiency skills. Tutors perform one-on-one work with individual students, group work, or class activities.",Tutoring Program,,"Santa Barbara, California",,https://americareads.as.ucsb.edu/,,,"Math, Reading",,"Kindergarten, 1st Grade, 2nd Grade, 3rd Grade, 4th Grade, 5th Grade, 6th Grade",,,Tutoring staff,,"In-Person, Virtual",,,,,,,"1:1, group, or class activities",,"During School, Out of School",,,,,,,,,,,,
Amplify,,,"At Amplify, we believe all teachers and students deserve high-quality materials. At Amplify, we strive to engage all students deeply with challenging content while also providing teachers with powerful tools that help them understand and respond to the needs of every student.",Tutoring Program,,,,https://amplify.com/,,,"English Language Arts (ELA), Early Literacy, Math, Reading, Science, Other",All,"Kindergarten, 1st Grade, 2nd Grade, 3rd Grade, 4th Grade, 5th Grade, 6th Grade, 7th Grade, 8th Grade",,,,,,,,,,,,,,,,,,,,,,,,,,
Augustine Literacy Project,,"Our mission is to improve the reading, writing and spelling skills of low-income students who struggle with literacy by providing free, long-term one-on-one instruction from highly trained volunteer tutors.","The Augustine Literacy Project-Charlotte works to improve the reading, spelling and writing skills of low income children who struggle with literacy.",Tutoring Program,,"Charlotte, North Carolina",North Carolina,https://alpcharlotte.org/,Nonprofit,1994,Early Literacy,,"1st Grade, 2nd Grade, 3rd Grade",,,,,In-Person,,,,Long Term,Twice a week,,1:01,,During School,,,,,,,,,School,,Free,"Alison S. Houser, Executive Director, ahouser@alpcharlotte.org"
Breakthrough Collaborative,,"Breakthrough Collaborative works with highly motivated, traditionally underrepresented students to achieve post-secondary success and empowers aspiring leaders to become the next generation of educators and advocates.",6-year cohort providing summer and after school tutoring (homework help) and college guidance through middle and high school.,"Tutoring Program, Other",,"Oakland, California","Alabama, California, Colorado, Connecticut, Florida, Georgia, Louisiana, Massachusetts, Minnesota, New Hampshire, New York, Ohio, Pennsylvania, Rhode Island",http://www.breakthroughcollaborative.org,Nonprofit,1978,"English Language Arts (ELA), Early Literacy, Math, Reading, Science, Other",,"6th Grade, 7th Grade, 8th Grade, 9th Grade, 10th Grade, 11th Grade, 12th Grade",,,,,In-Person,,,,,Varies,,Small group,,Out of School,,,,,,,,,Student,,Free,
Bullis Student Tutors,,"Selective student organization connecting high school tutors with K-12 students. Tutors provide in-person 1:1 support During-School's Academic Center, and also create YouTube videos explaining common concepts and content.","Selective student organization connecting high school tutors with K-12 students. Tutors provide in-person 1:1 support During-School's Academic Center, and also create YouTube videos explaining common concepts and content.","Tutoring Program, Academic Intervention, Other","Classroom-based learning, study hall, for upper school also individualized meetings with grade-level learning specialists.",,,https://www.bullis.org/page.cfm?p=667,Nonprofit,,"English Language Arts (ELA), Early Literacy, Math, Reading, Science, Social Studies, Other",All,"Pre-Kindergarten, Kindergarten, 1st Grade, 2nd Grade, 3rd Grade, 4th Grade, 5th Grade, 6th Grade, 7th Grade, 8th Grade, 9th Grade, 10th Grade, 11th Grade, 12th Grade, Post secondary",,,,,In-Person,,,50,,,,"Small group for lower and middle school, 1:1 for upper",,During School,,,,,,,,,Student,,,"Catherin Austin, Co-Director of Learning Support Services, catherine_austin@bullis.org"
CLASE Tutoring and Mentor Program,,,,"Tutoring Program, Other",Mentoring Program,"Athens, Georgia",,,Nonprofit,,"English Language Arts (ELA), Early Literacy, Math, Reading, Science, Social Studies, Other",All,"3rd Grade, 4th Grade, 5th Grade",,,,,In-Person,,,,,,,"1:1 or small groups, depends on needs",,During School,,,,,,,,,,,,"Paula Mellom, pjmellom@uga.edu"
Community of Volunteer Educators (COVE),,Our vision is to support communities by developing innovative academic programming to reduce educational inequities exacerbated by the COVID-19 pandemic.,The Community of Volunteer Educators (COVE) is a volunteer-run public service organization dedicated to providing tutoring services and educational enrichment experiences to communities in need across NYC.,"Tutoring Program, Other",Educational Enrichment,"New York, New York",,https://www.coveducators.org/,Nonprofit,,"Math, Science, Other","Social Studies, Foreign Language, and more.","Pre-Kindergarten, Kindergarten, 1st Grade, 2nd Grade, 3rd Grade, 4th Grade, 5th Grade, 6th Grade, 7th Grade, 8th Grade, 9th Grade, 10th Grade, 11th Grade, 12th Grade",,,,,Virtual,,,,,,,Differnet programs: some 1:1 some group,,,,,,,,,,,,,,
Crossroads Education: Learning Commons,,We aim to improve learning outcomes for all students by advancing innovation in education across the United States.,The Learning Commons is a working space installed in high schools that trains and pays students to tutor their peers in math.,Tutoring Program,"Learning Commons space, also uses Nexus, virtual whiteboard, included in every Learning Commons.","Indianapolis, IN",Indiana,www.crossroadseducation.org,Nonprofit,2016,Math,,"Kindergarten, 1st Grade, 2nd Grade, 3rd Grade, 4th Grade, 5th Grade, 6th Grade, 7th Grade, 8th Grade, 9th Grade, 10th Grade, 11th Grade, 12th Grade",English,,"Teacher, Tutoring Staff",,"Blended, In-Person, Virtual",,"65% African American, 35% White",300,,,,1:01,,"During School, Out of School",,Outreach through virtual connection and weekly emails.  Daily if necessary.,,,,,,,"Parent, School",Negotiated,None,
D65 Fluency Tutors: Kindergarten Learning Partners/Everybody reads,,,Program helps youngest learners develop a love of reading using classic picture books.,Tutoring Program,,"Evanston, Illionis",,https://www.northwestern.edu/lead-engage/community-engagement/connect-community…,Nonprofit,,Reading,,"Kindergarten, 2nd Grade, 3rd Grade, 4th Grade, 5th Grade",,,,,In-Person,,,,,,,1:01,,During School,,,,,,,,,,,,
Diocese of Wheeling Schools,,Diocesan schools in West Virginia created tutoring programs to tackle students' remote learning challenges.,New partnership in light of covid between DWC and neighborhood schools.,Tutoring Program,,,,https://wheeling.edu/wu-news/diocesan-schools-in-west-virginia-create-tutoring-…,,2020,"Math, Reading",Specific school subjects for high school like Micro Economics and Org Chemistry,"Kindergarten, 1st Grade, 2nd Grade, 3rd Grade, 4th Grade, 5th Grade, 6th Grade, 7th Grade, 8th Grade, 9th Grade, 10th Grade, 11th Grade, 12th Grade",,,,,Virtual,,,60,,,,1:01,,Out of School,,,,,,,,,Student,,,"Theresa DiPiero: Director of Curriculum and Instruction at Diocese of Wheeling-Charleston,"
Early Steps,,,"Early Steps is a first grade one-to-one tutoring model that is patterned on Reading Recovery. Early Steps employs a balanced approach to the teaching of reading, incorporating explicit instruction in phonemic awareness and phonics, as well as the reading experience activities favored by Reading Recovery. ES tutors work with students in reading new books at their instructional level, re-reading familiar texts, writing and learning problem-solving strategies that can be used to tackle difficult words.",Tutoring Program,,,,https://www.readingrockets.org/article/building-best-learning-what-works-early-…,,,,,1st Grade,,,,,,,,,,,,,,,,,,,,,,,,,,
FEV Tutor,,"FEV Tutor’s mission is to make high-quality, online learning options available to all students at all times.","1:1 tutoring in any subject, any grade in partnership with schools or districts or directly to student through families, available 24/7 with dosage, frequency and duration determined by goals set by student with teacher or family.",Tutoring Program,,,,https://www.fevtutor.com/,For Profit,2008,"English Language Arts (ELA), Early Literacy, Math, Reading, Science, Social Studies, Other",All,"Pre-Kindergarten, Kindergarten, 1st Grade, 2nd Grade, 3rd Grade, 4th Grade, 5th Grade, 6th Grade, 7th Grade, 8th Grade, 9th Grade, 10th Grade, 11th Grade, 12th Grade, Post secondary",,,,,"In-Person, Virtual",,,,,,,1:01,,"During School, Out of School",,,,,,,,,School,,,"Anirudh Baheti, CEO, edu@fevtutor.com"
For the Children,,,"Within Tulanes center for Public Service, in-school tutoring program at 2 New Orleans underperforming public schools.",Tutoring Program,,"New Orleans, LA",,http://volunteer.handsonneworleans.org/agency/detail/?agency_id=83927,,,Reading,,,,,,,In-Person,,,800,,,,Varies,,During School,,,,,,,,,,,,
Heart Math Tutoring,,,Tutors work with elementary schools in Charlotte-Mecklenberg.,Tutoring Program,,"Charlotte, NC",,http://www.hearttutoring.org,Nonprofit,,Math,,,,,,,In-Person,,,,,,,1:01,,During School,,,,,,,,,,,,
High School Suport Initiative,,,"Connects Stanford students with high school students from historically marginalized local communities as tutors, mentors and academic supports.","Tutoring Program, Other","Mentoring, Academic support","Stanford, CA",,,Nonprofit,,"English Language Arts (ELA), Early Literacy, Math, Reading, Science, Social Studies, Other",All,"9th Grade, 10th Grade, 11th Grade, 12th Grade",,,,,"In-Person, Virtual",,,,,,,,,"During School, Out of School",,,,,,,,,,,,
Huntington Learning,,,"Huntington Learning provides individualized tutoring from certified teachers to build and enhance the skills needed for school success and help children get the best grades possible on quizzes, tests, and report cards.",Tutoring Program,,,,https://huntingtonhelps.com/tutoring/elementary/reading,For Profit,,,,,,,,,,,,,,,,1:01,,,,,,,,,,,,,,
Kappa Delta Pi,,,Offering free virtual tutoring sessions for K-12 students for all subjects.,Tutoring Program,,"Edwardsville, IL",,https://www.alestlelive.com/news/main_campus/article_cfc7252e-1284-11eb-834b-c3…,Nonprofit,2020,"English Language Arts (ELA), Early Literacy, Math, Reading, Science, Social Studies, Other",All,"Pre-Kindergarten, Kindergarten, 1st Grade, 2nd Grade, 3rd Grade, 4th Grade, 5th Grade, 6th Grade, 7th Grade, 8th Grade, 9th Grade, 10th Grade, 11th Grade, 12th Grade, Post secondary",,,,,Virtual,,,,,,,1:01,,Out of School,,,,,,,,,"Parent, Student",,,barmart@siue.edu
Kumon,,,Series of 30-minute math worksheets that students complete at Kumon centers and at home.,Tutoring Program,,,,www.kumon.com,For Profit,,Math,,,,,,,In-Person,,,,,,,1:01,,Out of School,,,,,,,,,,,,
LEAP,,,"LEAP engages undergraduates in helping kindergarten through fourth grade students develop the language, literacy, math, and social skills necessary to succeed in school.",Tutoring Program,,"Rochester, NY",,https://www.rochester.edu/college/rccl/civic-engagement/leap/index.html,,,"English Language Arts (ELA), Early Literacy, Math, Reading, Science, Social Studies, Other",Languages,"Kindergarten, 1st Grade, 2nd Grade, 3rd Grade, 4th Grade",,,,,In-Person,,,,,,,1:01,,Out of School,,,,,,,,,,,,
Maroon Tutor Match (Part of NSP),,,Affordable and effective 1:1 Tutoring for local K-12 students.,Tutoring Program,,"Chicago, Illinois",,https://nsp.uchicago.edu/tutor-match,Nonprofit,,"English Language Arts (ELA), Early Literacy, Math, Reading, Science, Social Studies, Other",all,"Kindergarten, 1st Grade, 2nd Grade, 3rd Grade, 4th Grade, 5th Grade, 6th Grade, 7th Grade, 8th Grade, 9th Grade, 10th Grade, 11th Grade, 12th Grade",,,,,,,,388,,,,1:01,,,,,,,,,,,,,,","
Match Corps,,,"Students receive daily individual or group tutoring in additional to conventional instruction, extended school day.",Tutoring Program,,"Boston, MA",,http://www.matcheducation.org,Nonprofit,2004,"English Language Arts (ELA), Math",,,,,,,In-Person,,,1250,,,,1:1 or small group,,During School,,,,,,,,,,,,
Middle School Tutor,,,"Our tutors work one-on-one with fifth-, sixth-, seventh-, and eighth-grade students to help with homework completion at Buford Middle School and Walker Upper School. The tutors mainly motivate and encourage while also answering some questions regarding homework assignments.",Tutoring Program,,"Richmond, Virginia",,https://publicservice.virginia.edu/middle-school-tutor,Nonprofit,,,,"5th Grade, 6th Grade, 7th Grade, 8th Grade",,,,,In-Person,,,,,,,1:01,,Out of School,,,,,,,,,,,,
One-to-One Tutoring,,Provide individual academic support to elementary and middle school students.,Provides individual academic support to elementary and middle school students who live or attend school in 3 NY neighborhoods.,Tutoring Program,,"New York, New York",,https://one2onetutoring.wordpress.com/,,,"Math, Other","English, and effective study habits","Kindergarten, 1st Grade, 2nd Grade, 3rd Grade, 4th Grade, 5th Grade, 6th Grade, 7th Grade, 8th Grade",,,,,"In-Person, Virtual",,,,,,,1:01,,Out of School,,,,,,,,,"School, Student",,,one2oneweekendtutoring@gmail.com
Pirate Math,,,tutoring program for remediating the calculation and word-problem deficits and for promoting the algebraic cognition of third-grade students at-risk or with identified math disability.,Tutoring Program,,,,https://charts.intensiveintervention.org/intervention/toolGRP/9b269358c646b982,,,Math,,,,,,,In-Person,,,,,,,,,Out of School,,,,,,,,,Student,,,
GO Project,,"Our mission is to shape the futures of low-income New York City public school children by providing critical academic, social, and emotional support starting in the early elementary years.",Saturday program with teacher-led lesson and small group instruction.,"Tutoring Program, Other","Professional development, social skills","New York, NY",,www.goprojectnyc.org,Nonprofit,1968,"English Language Arts (ELA), Early Literacy, Math, Reading, Science, Social Studies, Other",All,"Kindergarten, 1st Grade, 2nd Grade, 3rd Grade, 4th Grade, 5th Grade, 6th Grade, 7th Grade, 8th Grade",,,,,In-Person,,,725,,,,Small group,,Out of School,,,,,,,,,"Parent, Student",,,"Andy DiBella, Chief Development Officer , adibella@goprojectnyc.org"
Project MORE,,"Help every student maximize reading potential, no matter their ability level.","Project MORE, Mentoring in Ohio for Reading Excellence, is a evidence based reading volunteer reading mentoring project for students with disabilities, that has demonstrated statistically significant reading results since 1999.",Tutoring Program,,Ohio,,https://www.ohioprojectmore.org/ProjectMore/Content2/about-us,Nonprofit,1999,"Reading, Other",Mentoring,,,,,,In-Person,,,4350,,,,1:01,,During School,,,,,,,,,"School, Student",,,"Sandy Maas: Administrative Assistant, project.more@putnamcountyesc.org"
"Read, Write and Type",,,"Our flagship software integrates phonics, reading, writing & keyboarding in a 40-lesson adventure linking each speech sound to a letter & finger stroke on the keyboard, as users pronounce, segment, type & spell hundreds of words!",Tutoring Program,,,,https://www.talkingfingers.com/read-write-type/,,,Reading,,,,,,,Virtual,,,,,,,,,Out of School,,,,,,,,,"School, Student",,,
Reading Recovery,,"Accelerate children's literacy learning, and to develop in them a love of reading and writing. All children deserve to reach their intellectual potential.",Short-term intervention for first graders in reading and writing. Specially trained teachers tutor 1:1 in daily 30-minute lessons lasting 12-20 weeks.,Tutoring Program,,,,https://readingrecovery.org/reading-recovery/,Nonprofit,,Reading,,"Kindergarten, 1st Grade, 2nd Grade, 3rd Grade, 4th Grade, 5th Grade, 6th Grade, 7th Grade, 8th Grade, 9th Grade, 10th Grade, 11th Grade, 12th Grade",,,,,In-Person,,,,,,,1:01,,During School,,,,,,,,,,,,
Snapask,,The curriculum provides a high-quality solution for fulfilling these requirements for pupils aged 9-11 years.,Subscription service for college students to ask questions via phone app.,Tutoring Program,,,,www.snapask.com,For Profit,,"English Language Arts (ELA), Early Literacy, Math, Reading, Science, Social Studies, Other",All,,,,,,Virtual,,,,,,,1:01,,Out of School,,,,,,,,,,,,
