Girls Who Math,,"We strive to make STEM fun, approachable, and accessible to young women from all walks of life. We provide free individual tutoring and small group classes while also working to remove the stigma surrounding girls with an interest in STEM.",One-on-one tutoring for students who need help with school math or school-level computer science.,Tutoring Program,,"Falls Church, Virginia","Alabama, Alaska, Arizona, Arkansas, California, Colorado, Connecticut, Delaware, Florida, Georgia, Hawaii, Idaho, Illinois, Indiana, Iowa, Kansas, Kentucky, Louisiana, Maine, Maryland, Massachusetts, Michigan, Minnesota, Mississippi, Missouri, Montana, Nebraska, Nevada, New Hampshire, New Jersey, New Mexico, New York, North Carolina, North Dakota, Ohio, Oklahoma, Oregon, Pennsylvania, Rhode Island, South Carolina, South Dakota, Tennessee, Texas, Utah, Vermont, Virginia, Washington, Washington DC, West Virginia, Wisconsin, Wyoming, Virtual",http://girlswhomath.net/,For Profit,2019,"Math, Science, Other",Computer Science,"Pre-Kindergarten, Kindergarten, 1st Grade, 2nd Grade, 3rd Grade, 4th Grade, 5th Grade, 6th Grade, 7th Grade, 8th Grade, 9th Grade, 10th Grade, 11th Grade, 12th Grade, Post secondary",English,,Volunteer,,Virtual,,,300+,60,1,However long the students need,1:01,,Out of School,,,No,,,No,,,"Parent, Student",$0 ,$0 ,
GoPeer,GoPeer's mission is to improve the quality and lower the cost of education. This is why GoPeer offers high-quality 1-to-1 tutoring at 1/3 the national average cost of professional tutoring.,GoPeer's mission is to improve the quality and lower the cost of education. This is why GoPeer offers high-quality 1-to-1 tutoring at 1/3 the national average cost of professional tutoring.,"10,000 college students are available to tutor K-12 students in over 153 subjects.",Tutoring Program,,"Providence, Rhode Island",Rhode Island,https://gopeer.org,For Profit,2017,"English Language Arts (ELA), Early Literacy, Math, Reading, Science, Social Studies, Other",All,"Pre-Kindergarten, Kindergarten, 1st Grade, 3rd Grade, 4th Grade, 5th Grade, 6th Grade, 7th Grade, 8th Grade, 9th Grade, 10th Grade, 11th Grade, 12th Grade, Post secondary","Chinese, English, French, Spanish, Other",Vietnamese,"Tutoring staff, Other","10,000 paid college undergraduate students.",Virtual,"70% English,  20% Spanish,  5% Mandarin Chinese,  5% French","Hispanic or Latino- 18%, American Indian or Alaska Native 2%, Asian 9.5%, Black or African American 33%, Native Hawaiian or Other Pacific Islander 2.5%, White 35%",40000,,Varies based on student request,,1:01,,"During School, Out of School",,"Families have access to GoPeer's Family Portal where they can access real-time progress reports, tracking, tutor communication, and complementary curriculum.",No,,,No,,,"Parent, Student",GoPeer does not partner with educational institutions or nonprofits at this time.,$20/hour or Free,
Heart Math Tutoring,,"The mission is to ensure all elementary students develop the strong foundation in math and enthusiasm for academics needed for long-term success, by helping schools use volunteers as tutors. The program serves as a Tier II Intervention for elementary students who are below grade level in math.",Tutors work with elementary schools in Charlotte-Mecklenburg and provide 30 minute 1:1 tutoring sessions twice per week during the school day. The program serves 50 students in grades 1-5 per school who are nominated by school staff based on their need for math support.,Tutoring Program,,"Charlotte, North Carolina",North Carolina,http://www.hearttutoring.org,Nonprofit,2013,Math,,"1st Grade, 2nd Grade, 3rd Grade, 4th Grade, 5th Grade",English,,"Tutoring Staff, Volunteer",,"In-Person, Virtual",,"4% Hispanic/Latino, 10% Asian, 11% Black or African American, 71% White",1193,30,2,26,1:01,,During School,,"We seek family permission for students to enroll after students are nominated by school staff. From there, we send quarterly progress reports and at-home math resources to families. In a typical school year, we host two family engagement events to celebrate student progress and practice math games with families.",No,,,Yes, https://hearttutoring.org/wp-content/uploads/2017/06/Heart_FinalReport_… ,,"District, School","Each school pays $10,000 per year. We raise $50,000 per school from community philanthropy per year.",,
HeyTutor,,"Access to the best tutors, nationwide, for collegiate and post graduate level coursework. We primarily focus on 1-1, individualized tutoring services.","Private, 1-1 tutoring services offering virtually with some in person availability.","Tutoring Program, Technology Platform",,"New York, NY","Alabama, Alaska, Arizona, Arkansas, California, Colorado, Connecticut, Delaware, Florida, Georgia, Hawaii, Idaho, Illinois, Indiana, Iowa, Kansas, Kentucky, Louisiana, Maine, Maryland, Massachusetts, Michigan, Minnesota, Mississippi, Missouri, Montana, Nebraska, Nevada, New Hampshire, New Jersey, New Mexico, New York, North Carolina, North Dakota, Ohio, Oklahoma, Oregon, Pennsylvania, Rhode Island, South Carolina, South Dakota, Tennessee, Texas, Utah, Vermont, Virginia, Washington, Washington DC, West Virginia, Wisconsin, Wyoming, Virtual",http://www.heytutor.com,For Profit,2014,"English Language Arts (ELA), Early Literacy, Math, Reading, Science, Social Studies, Other","ALL- K-12, College, Post Graduate, All Standardized Exams (LSAT,MCAT,GMAT etc.) , PHD, Professional Level (Bar, Series, Foreign Language, Computer Programming etc.)","Pre-Kindergarten, Kindergarten, 1st Grade, 2nd Grade, 3rd Grade, 4th Grade, 5th Grade, 6th Grade, 7th Grade, 8th Grade, 9th Grade, 10th Grade, 11th Grade, 12th Grade, Post secondary","Chinese, English, French, panish, Vietnamese, Other",Any,"Paraprofessional, Teacher",,"Blended, In-Person, Virtual",45% are bilingual. More importantly is working with a tutor specializing in tutoring a specific foreign language.,,2000,1 hr minimum. 1-2 hours is average.,Flexible. 2-3 is average.,Flexible. 6-20 average.,1:01,,Out of School,,Up to the discretion of whomever signs up. We are happy to notate the contact details of parents if necessary for tutor to be in communication with anyone other than the student.,No,,,No,,,"District, Nonprofit, Parent, School, Student",Varies,Varies. $45+/hr,
Hill Learning Center Reading Achievement Program,,"We transform students with learning differences into confident, independent learners.","Hill Learning Center provides students and educators with the instruction, tools, and support they need to succeed in school, and in life. We serve students directly, and share the evidence based practices implemented in our school with educators everywhere via the Hill Learning System and educator professional development. Our signature program is HillRAP (Reading Achievement Program.) Hill Tutoring serves families with both individual tutoring and small-group classes that are built upon research, individualized instruction, and successful teaching techniques.",Tutoring Program,,"Durham, NC",North Carolina,https://www.hillcenter.org/professional-development/hill-methodology/hillrap-re…,Nonprofit,1977,"English Language Arts (ELA), Math, Reading, Other",Executive Function,"Kindergarten, 1st Grade, 2nd Grade, 3rd Grade, 4th Grade, 5th Grade, 6th Grade, 7th Grade, 8th Grade, 9th Grade, 10th Grade, 11th Grade, 12th Grade",,,Teacher,,"Blended, In-Person, Virtual",,,2503,30-45,,Based on client need.,1:1 or small group of no more than 4 students.,,Out of School,,Regular reports and updates of progress and monthly free community education events.,No,,,Yes,https://www.tandfonline.com/doi/abs/10.1080/15377900802487201?journalCo…,"0.55-0.78, each component of the lesson was measured independently","Parent, School, Student",Varies depending on size of the project and philanthropic dollars,$50-$75 per hour,"Beth Anderson, Executive Director"
Hoot Reading,"Hoot Reading's mission is to to close the 4th grade reading gap and build independent, confident, lifelong learners.","Hoot Reading's mission is to to close the 4th grade reading gap and build independent, confident, lifelong learners.","Hoot Reading is an online tutoring service that is focused on literacy. We connect kids with experienced, hand selected teachers, to practice reading over video chat.","Tutoring Program, Technology Platform",,Virtual,,https://www.hootreading.com/tutor/,For Profit,2018,Reading,,"Pre-Kindergarten, Kindergarten, 1st Grade, 2nd Grade, 3rd Grade, 4th Grade, 5th Grade, 6th Grade","English, French, Other",Spanish under development.,Teacher,,,,,,20,3-Feb,,1:01,,Out of School,,Parents receive periodic reports.,No,,,Yes,https://xpmrqmi8i9nphz8lw6la02-wpengine.netdna-ssl.com/wp-content/uploa…,,Parent,,An average of $22 per lesson.,
Ingenify,,"At Ingenify, it is our mission to help students succeed academically by providing free, virtual tutoring.",Ingenify is a two sided marketplace that connects high school volunteers with kids who need free tutoring.,"Tutoring Program, Technology Platform",,"Johns Creek, GA",Georgia,https://ingenify.org,Nonprofit,2020,"English Language Arts (ELA), Math, Reading, Science, Social Studies",,"Kindergarten, 1st Grade, 2nd Grade, 3rd Grade, 4th Grade, 5th Grade, 6th Grade, 7th Grade, 8th Grade, 9th Grade, 10th Grade, 11th Grade, 12th Grade",English,,Volunteer,,Virtual,,,300,50,,,3:01,,Out of School,,,No,,,No,,,"Parent, School, Student",0,0,
Inspiring Minds,,"Inspiring Minds empowers students to succeed in school and life by providing them with trusted relationships, tutoring and mentoring by inspired community members.","Volunteers are matched with students in small groups to develop a trusting, relationship and to engage in structured activities, often around classroom or homework-related topic. Inspiring Minds views tutoring as the direct and clearly defined work to support the student's academic skill development and mentoring as the more indirect work aimed at cultivating caring, positive relationships which will boost student confidence and promote academic achievement.",Tutoring Program,,"Providence, RI",Rhode Island,https://inspiringmindsri.org,Nonprofit,,"English Language Arts (ELA), Early Literacy, Math, Reading",,"Pre-Kindergarten, Kindergarten, 1st Grade, 2nd Grade, 3rd Grade, 4th Grade, 5th Grade","English, Spanish",,Volunteer,,"In-Person, Virtual",20% are Spanish speaking,"Hispanic or Latino- 72%, American Indian or Alaska Native-5%, Asian- 8%, Black or African American 17%, Native Hawaiian or Other Pacific Islander",1047,60,Varies by student needs,24-28,1:1 up to 4:1,,During School,,,No,,,No,,,"District, School",,0,
Intervene K12,"At Intervene K-12, we engage and empower struggling students to become high performers. We believe in building equity in education. We make the benefits of tutoring affordable and accessible to all districts and schools.","Intervene K-12 provides academic recovery and drives student success through comprehensive interventions, including assessments, analytics, and online LIVE small group instruction.","Intervene K-12's web-based platform supports data-driven, high-dosage small group tutoring for K-12 students across content areas. Intervene K-12 works closely with districts to diagnose students' misunderstanding by utilizing researched-based analytics. The programs' whole child approach prioritizes creating an authentic instructional environment that is culturally responsive.","Tutoring Program, Academic Intervention",,"Houston, TX","Alabama, Alaska, Arizona, Arkansas, California, Colorado, Connecticut, Delaware, Florida, Georgia, Hawaii, Idaho, Illinois, Indiana, Iowa, Kansas, Kentucky, Louisiana, Maine, Maryland, Massachusetts, Michigan, Minnesota, Mississippi, Missouri, Montana, Nebraska, Nevada, New Hampshire, New Jersey, New Mexico, New York, North Carolina, North Dakota, Ohio, Oklahoma, Oregon, Pennsylvania, Rhode Island, South Carolina, South Dakota, Tennessee, Texas, Utah, Vermont, Virginia, Washington, Washington DC, West Virginia, Wisconsin, Wyoming, Virtual",https://www.intervenek12.com,For Profit,2017,"English Language Arts (ELA), Early Literacy, Math, Reading, Other",English Language / ESL/ ELL & CTE,"3rd Grade, 4th Grade, 5th Grade, 6th Grade, 7th Grade, 8th Grade, 9th Grade, 10th Grade, 11th Grade, 12th Grade","English, Spanish",,"Paraprofessional, Teacher, Tutoring Staff",,Virtual,60% Spanish,"40% Hispanic or Latino, 5% Asian, 40% Black or African American, 15% White","30,000",45-60,5-Mar,Based on district needs (20-40 weeks),4:1 up to 8:1,,"During School, Out of School",,Parent access to programs and bilingual support.,No,,,No,,,"District, School",Depends on size of program and services provided.,n/a,
iTutor.com,,,"We strive to close the equity and access gap for under-served populations Nationwide and provide high-quality tutoring by partnering with schools and universities to make available cost-effective online education services. In addition to the direct provision of supplemental academic supports, we train teachers and paraprofessionals to become more effective.","Tutoring Program, Technology Platform, Academic Intervention",,"Jericho, NY","Alaska, Arizona, California, Colorado, Connecticut, Delaware, Florida, Georgia, Illinois, Kansas, Kentucky, Maine, Maryland, Minnesota, Montana, New Jersey, New Mexico, New York, North Carolina, Pennsylvania, South Carolina, Texas, Virginia, Wisconsin, Virtual",https://itutor.com/schools,For Profit,2013,"English Language Arts (ELA), Early Literacy, Math, Reading, Science, Social Studies, Other","Foreign Languages, ACT/SAT test prep, AP level subjects","Kindergarten, 1st Grade, 2nd Grade, 3rd Grade, 4th Grade, 5th Grade, 6th Grade, 7th Grade, 8th Grade, 9th Grade, 10th Grade, 11th Grade, 12th Grade, Post secondary","English, Spanish",,Teacher,,Virtual,,,,,,,,,"During School, Out of School",,,No,,,Yes,JHU-IDR : https://drive.google.com/drive/u/1/folders/1NJU_g8IO9Mv97kDx24np2P98RVH… JHU-IDR ExecSum: https://docs.google.com/document/d/1AeJlEF5xVl6Eehx6jtCzK8G6Ve4GhrEk/ed…,,"District, School",$55-$110 per hour depending on student:teacher ratios,N/A,
Ivy Tutors Network,,Education is not one size fits all. We help students find joy in learning through personalized education.,"For almost 20 years, Ivy Tutors Network's brilliant and caring tutor-mentors have inspired students to achieve through fundamental skills-teaching and a growth mindset curriculum, in both individual and small group settings. Our team of 50+ best-in-class, vetted tutors work with kids of all ages to help them achieve their scholastic potentials, retain knowledge, increase confidence, receive higher scores on exams, and gain admittance to the best schools. We arm students with skills, strategies, and thirst for knowledge that will carry them through school, college, and beyond.",Tutoring Program,,"New York, NY","California, Maryland, Massachusetts, New Jersey, New York, Rhode Island, Vermont, Washington DC, Virtual",https://ivytutorsnetwork.com/,For Profit,2003,"English Language Arts (ELA), Early Literacy, Math, Reading, Science, Social Studies, Other","SAT, ACT, SHSAT, TACHS, ISEE, SSAT, AP Courses, Statwide and Citywide testing (incl: Regents, Common Core), GRE, GMAT, LSAT, College Essay, College Admissions, Economics, Statistics","Pre-Kindergarten, Kindergarten, 1st Grade, 2nd Grade, 3rd Grade, 4th Grade, 5th Grade, 6th Grade, 7th Grade, 8th Grade, 9th Grade, 10th Grade, 11th Grade, 12th Grade, Post secondary","Chinese, English, French, Spanish, Vietnamese, Other",,"Teacher, Tutoring Staff",,"Blended, In-Person, Virtual","20% speak Spanish, 15% speak French,","20% Hispanic or Latino, 10% Asian, 20% Black or African American, 50% White",400,Varies,Varies,Varies,,,"During School, Out of School",,"Tutors send after-session notes to families. We also send monthly progress reports and reports post-assessment (diagnostic & mock test). These can be sent to families and/or schools, as requested.",No,,,No,,,"District, Nonprofit, Parent, School, Student",Varies,Varies,
Kelly Education,,Our structured and managed program bridges the learning gap by connecting students with qualified Kelly tutors in core academic areas.,"Kelly Education, an established presence inside schools across the United States, will closely partner with parents and teachers to ensure tutoring meets individual student's needs. Tutoring solutions are designed with insights based on its work with school districts over the past 20 years. Upon completing a needs assessment, the education team develops a plan to show how an effective tutoring program should be structured.
 ","Tutoring Program, Academic Intervention",,"Troy, Michigan","Alabama, Alaska, Arizona, Arkansas, California, Colorado, Connecticut, Delaware, Florida, Georgia, Hawaii, Idaho, Illinois, Indiana, Iowa, Kansas, Kentucky, Louisiana, Maine, Maryland, Massachusetts, Michigan, Minnesota, Mississippi, Missouri, Montana, Nebraska, Nevada, New Hampshire, New Jersey, New Mexico, New York, North Carolina, North Dakota, Ohio, Oklahoma, Oregon, Pennsylvania, Rhode Island, South Carolina, South Dakota, Tennessee, Texas, Utah, Vermont, Virginia, Washington, Washington DC, West Virginia, Wisconsin, Wyoming, Virtual",http://kellyeducationalstaffing.us/tutors,For Profit,2001,"English Language Arts (ELA), Early Literacy, Math, Reading, Science, Social Studies",,"Pre-Kindergarten, Kindergarten, 1st Grade, 2nd Grade, 3rd Grade, 4th Grade, 5th Grade, 6th Grade, 7th Grade, 8th Grade, 9th Grade, 10th Grade, 11th Grade, 12th Grade, Post secondary",English,,"Teacher, Tutoring Staff",,"Blended, In-Person, Virtual",,,,Customizable,Customizable,Customizable,"1:1, 2:1, 3:1",,"During School, Out of School",,We provide updates on student progress to the parents and teachers.,No,,,No,,,"District, Parent, School, Student",Cost varies by state and by student to tutor ratio.,,
Knoyo Tutoring,,"Our mission is to provide students with a pressure-free environment to learn, find community, and achieve their dreams. Whether they just need homework help, need to prepare for the SAT, or are feeling unsure about what college to choose, we're here to help. By creating a space where students of all kinds can feel welcome and at ease, we hope to help them navigate their individual experiences with confidence.","Knoyo connects students from all walks of life so they may share their individual experiences and knowledge. Our tutors are college honors students from universities all across the country, from junior colleges to the Ivy League, to ensure that there's a perfect tutor for each student. We created this space to foster these invaluable connections, giving students a strong foundation to grow from.",Tutoring Program,,"Atlanta, GA",Virtual,https://www.knoyo.com,For Profit,2020,"English Language Arts (ELA), Early Literacy, Math, Reading, Science, Social Studies, Other","Elementary English, Algebra, Biology, Chemistry, English, Geometry, Life sciences, Creative Writing, English Composition, ESOL, Literature, Precalculus, Calculus 1, Calculus 2, Statistics, Geometry/Trigonometry, Chemistry, Physics, American History","Kindergarten, 1st Grade, 2nd Grade, 3rd Grade, 4th Grade, 5th Grade, 6th Grade, 7th Grade, 8th Grade, 9th Grade, 10th Grade, 11th Grade, 12th Grade, Post secondary","Chinese, English, French, Spanish, Other","Mandarin, Arabic, Latin",Peer,,Virtual,"25% speak Spanish, 8% speak French, 1% speak Mandarin, 1% fluent in Latin, 0.5% speak Arabic",,,30-60,Dependent on student request,,1:01,,Out of School,,,No,,,No,,,"Parent, Student",,"Each tutor sets their own rate, minimums $21.99/ 30 minute session, $39.99/ 1 hour session.",
Learning Lodge,"Mission to support students learning from home through free, online tutoring, and especially those who have been adversely affected by the pandemic.","Mission to support students learning from home through free, online tutoring, and especially those who have been adversely affected by the pandemic.","In response to COVID-19 school closures, Learning Lodge provides free virtual tutoring by connecting college volunteers with elementary and middle school students.",Tutoring Program,,"St. Louis, Missouri","Missouri, Virtual",https://www.learninglodge.org/,Nonprofit,2020,"Math, Science, Social Studies, Other",Foreign Language,"Kindergarten, 1st Grade, 2nd Grade, 3rd Grade, 4th Grade, 5th Grade, 6th Grade, 7th Grade, 8th Grade","Chinese, English, French, Spanish",,Volunteer,,Virtual,"80% English only, 20% English+Mandarin Chinese.","Asian 20%,Black or African American 10%,White 70%",591,60,Varies based on student need,,1:01,,Out of School,,All communications between Learning Lodge/tutors are with the student's parents. We ask for parental input to get a better idea of a student's specific needs.,No,,,No,,,"Parent, Student",,Free,
Mastery Learning Hour,,"By training student volunteers in innovative teaching strategies and giving them the support they need to thrive, it's our mission to provide the highest possible quality free tutoring to every K12 child in the world anytime anywhere in any subject. Through this approach, we hope to 1) erase inequity in education through access to high quality 1-1 instruction 2) raise compassionate citizens who have formed healthy attachments with positive role models 3) build a society of critical thinkers who are able to use scientific reasoning to analyze and take action in their world 4) inspire and support the next generation of teachers through excellent training and meaningful field work. We hope to achieve this by rigorous attention to training and active collaboration with schools, teachers and parents. We're starting with K12 math in English and Spanish, but it's our ultimate aim to provide tutoring in every subject, not just STEAM, but play-based learning, foreign language and other eclectic subject 24 hours a day.","Masteryhour.org is a free, online tutoring program for K12 students, led by volunteers from colleges and universities, currently offered in English and Spanish. We use a mastery-based approach to ensure students advance at their own rate.  All our tutors are trained in innovative teaching techniques including inquiry-based learning. anti-bias education, child-centered communication differentiating learning and cultivating a growth mindset. Volunteer professors and math teachers come to observe tutoring sessions and offer feedback and support to the student tutor volunteers. All the tutoring happens in the Mastery Hour zoom room. Students can drop in whenever they need tutoring and are paired with tutors in breakout rooms - or can stay in the main room for study hall (occasionally asking a question as needed). While we're starting with math offered twice a day in our zoom room, we hope to add more subjects and hours until Masteryhour.org is available 24 hours a day for free to any child who needs it.","Tutoring Program, Technology Platform, Academic Intervention",,"San Francisco, CA",Virtual,http://www.masteryhour.org,Nonprofit,2020,"English Language Arts (ELA), Early Literacy, Math, Reading",,"Pre-Kindergarten, Kindergarten, 1st Grade, 2nd Grade, 3rd Grade, 4th Grade, 5th Grade, 6th Grade, 7th Grade, 8th Grade, 9th Grade, 10th Grade, 11th Grade, 12th Grade","Chinese, English, French, Other","Vietnamese, German","Peer, Volunteer",,Virtual,,,,,,,,,"During School, Out of School",,"We actively collaborate with the school, teacher and families via our orientation, phone, email, slack group and parent workshops to ensure positive outcomes for students. After every session, parents, tutors and students are required to send us a feedback form about their session so we can work together to ensure the student is getting the utmost gain out of the program. We also communicate with the school.",No,,,No,,,"District, Nonprofit, Parent, School",0,0,"Manisha Snoyer, manisha@masteryhour.org"
MindMatch,,Our mission is to help parents find the best teacher to support the academic growth of their child through a meaningful and effective online learning experience.,"We pair students with experienced, background-checked teachers based on preferred learning style for 1:1 online tutoring sessions.","Tutoring Program, Technology Platform, Academic Intervention",,"Houston, TX",Virtual,http://www.mindmatch.com,For Profit,2020,"English Language Arts (ELA), Early Literacy, Math, Reading, Science, Social Studies",,"Kindergarten, 1st Grade, 2nd Grade, 3rd Grade, 4th Grade, 5th Grade, 6th Grade, 7th Grade, 8th Grade, 9th Grade, 10th Grade, 11th Grade, 12th Grade","English, Spanish",,Teacher,,Virtual,15% speak Spanish,"15% Hispanic/Latino, 10% Asian, 45% Black or African American",,60,1,4,1:01,,Out of School,,We establish a close relationship with parents and guardians to understand the challenges every student is facing and set expectations. The communication with parents is constant and direct. MindMatch teachers and team is available for parents when needed. Teachers have a direct communication with parents to report progress and/or feedback from every lesson.,No,,,No,,,Parent,,,
