Open Literacy,Ensure learners K-5 have access to high quality reading instruction rooted in the science of reading.,Ensure learners K-5 have access to high quality reading instruction rooted in the science of reading.,"OpenLiteracy Reading is anchored in the Science of Reading and its high impact tutoring follows a sequence of lessons that begins with letter sounds, beginning blending, and phonological awareness and moving through advanced phonics. Students who complete levels 9 in the OpenLiteracy Reading sequence successfully will read at an end of second grade level.","Tutoring Program, Other",Intensive reading tutoring.,"Pittsburg, Pennsylvania",Virtual,https://openliteracy.com/,For Profit,2013,"English Language Arts (ELA), Reading",,"Pre-Kindergarten, Kindergarten, 1st Grade, 2nd Grade, 3rd Grade, 4th Grade, 5th Grade",English,,Other,College students,Virtual,,,,30,3,6,4:01,,"During School, Out of School",,Aimed as a resource for families teaching their young children to read.,No,,,No,,,"Parent, School",Each 6 week cycle of 18 lessons is $180/student.,Each 6 week cycle of 18 lessons is $180/student.,
PAPER,To give every student an equal opportunity to excel academically.,To give every student an equal opportunity to excel academically.,"Paper helps give every student an equal opportunity to excel academically. K-12 school districts throughout the U.S. and Canada count on Paper to promote educational equity, deliver personalized learning, and deploy academic support at scale. Our educational support system (ESS) provides learners with unlimited 24x7 homework help, writing feedback and study support at a predictable fixed cost. Papers specialized tutors deliver on demand, 1:1 academic support in four languages across more than 200 academic subject areas so students always have access to expert extra help exactly when, where and how they need it.",Tutoring Program,,"Montreal, Canada","California, Colorado, Florida, Illinois, Massachusetts, New York, Pennsylvania, Texas, Utah, Washington",https://paper.co/,For Profit,2014,"English Language Arts (ELA), Early Literacy, Math, Reading, Science, Social Studies, Other","All, including essay feedback.","Pre-Kindergarten, Kindergarten, 1st Grade, 2nd Grade, 3rd Grade, 4th Grade, 5th Grade, 6th Grade, 7th Grade, 8th Grade, 9th Grade, 10th Grade, 11th Grade, 12th Grade, Post secondary","Chinese, English, French, Spanish",,,,Virtual,,,"800,000",,Varies based on student need,,1:01,,Out of School,,"We provide parent resources in multiple languages, and co-host parent webinars alongside our partner schools.",No,,,No,,,"District, Nonprofit, School",$/student based on the number of students.,Free,
Peer Power Foundation,To inspire and empower student success through peer-to-peer tutoring and mentoring.,To inspire and empower student success through peer-to-peer tutoring and mentoring.,"Peer Power recruits and trains high-performing college students, called Success Coaches, to tutor in public classrooms and mentor high school students to encourage active learning, valuing education, and being personally accountable for their futures.",Tutoring Program,,"Memphis, Tennessee",Tennessee,https://peerpowerfoundation.org/,Nonprofit,2004,"English Language Arts (ELA), Math, Science, Social Studies, Other","High School Level: All high school state tested subjects, ACT, College and Career Readiness (Scholarships, FASFA, College Essays and Applications); Middle School Level: Math, Reading and English.","6th Grade, 7th Grade, 8th Grade, 9th Grade, 10th Grade, 11th Grade, 12th Grade",English,,Tutoring staff,,"In-Person, Virtual","98% English, 2% Spanish","Hispanic or Latino 5%, Black or African American 75%, White 20%",5000+,,Varies based on student needs,,2:1 or 3:1,,"During School, Out of School",,"Texting, email, and targeted programming and events.",No,,,No,,,"School, Student",Average annual cost of running Peer Power in a school is $750 per students- but Peer Power pays tutors.,Cost is covered by donations and is free to students.,
PeerGuide,,PeerGuide's mission is to provide free educational assistance to K-9th grade students who don't have sufficient academic support at home.,"Our program utilizes high-school and college students to assist younger children that don't have the educational support they need to succeed and reach their potential in school. All meetings we hold are virtual as our tutors and students live across the country. Our sessions are usually held on ZOOM, and schedules for sessions are very flexible as they are agreed upon by the parent/guardian of the student and the tutor. We are open to any accommodations or suggestions you may have as a student or a tutor in the future.","Tutoring Program, Technology Platform",,"Seattle, WA",Virtual,https://www.peerguide.org/,Nonprofit,2020,"English Language Arts (ELA), Early Literacy, Math, Reading, Science, Social Studies, Other",We offer clubs for extra learning opportunities such as virtual classes for piano and computer science.,"Kindergarten, 1st Grade, 2nd Grade, 3rd Grade, 4th Grade, 5th Grade, 6th Grade, 7th Grade, 8th Grade, 9th Grade","English, Spanish",,"Peer, Volunteer, Other",High-school and college students,Virtual,"20% are fluent in a foreign language (including Hindi, Cantonese, and Spanish).","10% Hispanic or Latino, 60% Asian, 1% Black or African American, 29% White",178,60,1+ sessions per week depending on the student's needs,1:1 - 2:1,,,Out of School,,Parent/Guardian is usually the point of contact as most of our students are elementary or middle school students.,No,,,No,,,"District, Parent, School, Student",0,0,
Read Alliance,Works to accelerate the educational trajectory of early elementary students through the power of teens who provide one-to-one literacy tutoring in under-resourced communities.,Works to accelerate the educational trajectory of early elementary students through the power of teens who provide one-to-one literacy tutoring in under-resourced communities.,Read Alliance helps to shrink the achievement gap by pairing early elementary children with high school students trained and paid to provide one-to-one tutoring in foundational reading skills.,"Tutoring Program, Other",Individual phonics-based reading tutoring sessions complemented by literacy enhancements that include read alouds and lending library books.,"New York, New York",New York,https://readalliance.org/,,2000,Early Literacy,,"Kindergarten, 1st Grade, 2nd Grade",English,,Other,High schools students who are paid minimum wage.,"In-Person, Virtual",100% English,"Hispanic or Latino- 36%, Asian 10%, Black or African American 43%, White 11%",1049,45,,,1:01,,Out of School,,"Teachers/educators from the partner sites are employed by READ to help supervise the program and assist with family outreach during traditional programming to encourage enrollment. This outreach is complemented by invitations to families to participate in an â€œopen houseâ€ during program to observe how the sessions are run, and invitations to families to attend the completion ceremony at the conclusion of each program cycle. Throughout the series, children bring home â€œGot Growthâ€ charts that communicate the childâ€™s level, the number of books read, and an encouraging comment from the childâ€™s teen tutor. During the virtual program, READ facilitates a special family orientation before program begins to help provide the framework of the program, provide specific instructions for signing on and how best to support their child while in READ.",No,,,Yes,https://xpmrqmi8i9nphz8lw6la02-wpengine.netdna-ssl.com/wp-content/uploa…,,"Nonprofit, School","Typically $12,500 partnership fee + $6,000 for teacher wages.",Free,
Seeds of Literacy,,We are fighting a root cause of poverty (illiteracy) by providing education services that help adults thrive in their communities.,"We provide one-to-one tutoring for adult education and high school equivalency preparation (GED/TASC/HiSET) at two Cleveland-area locations, as well as nationally in our Virtual Classroom, conducted through Zoom. Our tutors are all volunteers. Unlike other programs, tutors may work with a different student each day. Because our adult learners did not succeed in more traditional classroom settings, our program offers the ultimate flexibility. ",Tutoring Program,,"Cleveland, Ohio","Ohio, Virtual",https://www.seedsofliteracy.org/,Nonprofit,1997,"English Language Arts (ELA), Math, Reading, Science, Social Studies, Other",Beginning readers (adults),"1st Grade, 2nd Grade, 3rd Grade, 4th Grade, 5th Grade, 6th Grade, 7th Grade, 8th Grade, 9th Grade, 10th Grade, 11th Grade, 12th Grade",English,,"Tutoring Staff, Volunteer",,Virtual,,"Hispanic or Latino- 10.30%, American Indian or Alaska Native-1.40%, Asian- 13.70%, Black or African American 13.70%, White 61%",1000,120,12,Ongoing,1:01,,"During School, Out of School",,,No,,,No,,,Student,,0,
Sharity Tutoring,,"Sharity Tutoring strives to provide free tutoring services to children in grades K-12. By working with a group of gifted high schoolers, we are determined to build productive relationships and create a strong academic foundation.","Since 2020, Sharity Tutoring Inc. has been committed to supporting our community by providing free tutoring services to as many children as possible. On top of managing countless AP, IB, and AICE classes, the tutors at Sharity Tutoring are extremely involved in their community and are dedicated to providing academic assistance as well as guidance to students in grades K-12. By booking an appointment, individuals will receive a private virtual tutoring session completely free of cost. Sharity Tutoring is a 501(c)(3) certified nonprofit incorporation whose goal is to build a community of learners both locally and internationally through free tutoring services. In order to maximize the number of students Sharity's tutors are able to work with, tutors have developed flexible schedules to accommodate students on weekdays as well as weekends.",Tutoring Program,,"Wellington, FL",Virtual,https://www.sharitytutoring.com/,Nonprofit,2020,"English Language Arts (ELA), Early Literacy, Math, Reading, Science, Social Studies, Other","Spanish, Physics, French, Italian, Economics, Biology, Chemistry, Music Theory, and Korean","Kindergarten, 1st Grade, 2nd Grade, 3rd Grade, 4th Grade, 5th Grade, 6th Grade, 7th Grade, 8th Grade, 9th Grade, 10th Grade, 11th Grade, 12th Grade","Chinese, English, French, Spanish, Other","Korean, Italian, Creole","Peer, Tutoring Staff, Volunteer",,Virtual,"28% speak Spanish, 6% speak Italian, 6% speak French, 6% speak Korean, 11% speak Chinese, 11% speak Creole","28% Hispanic or Latino, 22% Asian, 11% Black or African American, 39% White",18,30-90,,Continous,1:01,,Out of School,,"Tutors speak with parents to book sessions as a form of parental consent. Upon request, tutors will provide a summary of the materials that were covered during the session.",No,,,No,,,"Nonprofit, Student",0,0,
Springboard Collaborative,"Springboard Collaborative closes the literacy gap by bridging the gap between home and school. We coach educators and family members to help kids learn to read by 4th grade. In doing so, we enable school communities to accelerate learning by harnessing th","Springboard Collaborative closes the literacy gap by bridging the gap between home and school. We coach educators and family members to help kids learn to read by 4th grade. In doing so, we enable school communities to accelerate learning by harnessing the untapped teaching potential within families.","Springboard's recipe for impact is a method we call Family-Educator Learning Accelerators (or FELAs). FELAs are 5-10-week cycles during which teachers and parents team up to help kids reach learning goals. Programming combines personalized reading instruction for PreK-3rd graders, weekly workshops training parents as reading coaches, and professional development for educators.","Tutoring Program, Academic Intervention, Other",Family Engagement,"Philadelphia, Pennsylvania","California, Connecticut, Delaware, Maryland, Massachusetts, Michigan, New York, Pennsylvania, Washington DC",www.springboardcollaborative.org,Nonprofit,2011,Reading,,"Pre-Kindergarten, Kindergarten, 1st Grade, 2nd Grade, 3rd Grade, 4th Grade",English,,"Paraprofessional, Parent, Teacher, Tutoring Staff",,"Blended, In-Person, Virtual",,,10000+,30,4-Mar,Each FELA is a 5-10-week goal-setting cycle.,Varies up to 15:1,,"During School, Out of School",,Parents participate in training and provide home-based instruction.,No,,,Yes,https://tracking.cirrusinsight.com/15123887-7af4-4901-8478-f598f21654f4…,Students averaged 1.8 months of sustained reading growth with just 5 weeks of programming. Students who started below grade level. Rising 4th graders who started programming more than a year below grade-level averaged a 4.4-month gain in 5 weeks.,School,"Springboard charges a per school fee for partner support (i.e.: training and coaching) and a per student fee for resources (e.g.: curriculum, books, incentives, etc.). For Springboard's 'Premier' offering, the partner support package is $15K/school.",Free,
Step Up Tutoring,,Step Up Tutoring's mission is to improve student success through academic support and mentorship in under-resourced communities.,"Step Up Tutoring is a non-profit organization that recruits, screens, trains, matches and supports volunteer tutors with elementary school students for twice per week online tutoring and mentoring. Tutoring currently focuses on English Language Arts and math. ",Tutoring Program,,"Los Angeles, CA",California,https://www.stepuptutoring.org/,Nonprofit,2020,"English Language Arts (ELA), Early Literacy, Math, Reading",,"3rd Grade, 4th Grade, 5th Grade, 6th Grade","English, Spanish",,Volunteer,,Virtual,"13% fluent Spanish, 50% basic Spanish",,640,45,2,Ongoing,1:01,,Out of School,,"Step Up hosts family orientations to ensure families are clear what to expect from the program and how to best support their students. Step Up shares weekly Step Up Tutoring updates with the families and provides opportunities for family feedback via surveys and focus groups. Additionally, we try to engage families and build relationships through fun events such as Family Games Nights.",No,,,No,,,"District, School",Free,Free,
Student Power,,Student Power is a student- led portal.  We are providing a student to student tutoring platform that supports student learning and empowers students to achieve success.,"The sudden switch to virtual learning impacted all K-12 students, the ones whose education was impacted most were elementary and middle schoolers.  Our team saw an opportunity to build a community to teach young students and help older students meet their graduation requirements through Student Power.","Tutoring Program, Technology Platform",,"Houston, TX",Texas,https://studentpower.co,For Profit,2020,"English Language Arts (ELA), Early Literacy, Math, Reading, Science, Social Studies, Other",Languages,"1st Grade, 2nd Grade, 3rd Grade, 4th Grade, 5th Grade, 6th Grade, 7th Grade, 8th Grade","Chinese, English, French, Spanish",,Peer,,Virtual,90%,,,30,3,12,1:01,,Out of School,,Parent Portal.,No,,,No,,,"Parent, School, Student","an annual fee of $3,000 for the School Orientation Package, plus a one-time set-up and implementation fee of $2,000 and a10 dollar per student per year charge.",0,
Tennessee Tutoring Corps,To support student learning through the summer and help stave off a dramatic COVID slide.,To support student learning through the summer and help stave off a dramatic COVID slide.,7-8 week program using trained college students to tutor students in 1st-4th grade through pre-existing community-based summer programs.,Tutoring Program,,"Nashville, Tennessee",Tennessee,,Nonprofit,2020,"English Language Arts (ELA), Math",,"1st Grade, 2nd Grade, 3rd Grade, 4th Grade",English,,Other,Paid college students,In-Person,95-100% English speaking,"Hispanic or Latino- 7% Asian 6%, Black or African American 20%, White 66%",2000,120,4,8,"2:1, 3:1. 4:1, 5:1",,Out of School,,Parents received a letter from TTC explaining the program and how to further support their students with learning when they were at home.,No,,,No,,,Nonprofit,Free,Free,
The Great Oaks Foundation,"For the past ten years, the Great Oaks (GO) Foundation has recruited, trained and supported recent college graduates in a year-long Fellowship to intensively tutor and mentor students from low-income, urban communities.  The best of those Fellows are recr","For the past ten years, the Great Oaks (GO) Foundation has recruited, trained and supported recent college graduates in a year-long Fellowship to intensively tutor and mentor students from low-income, urban communities.  The best of those Fellows are recruited to participate in a Teacher Residency program to train to become effective classroom teachers.","Through a grant from the federal Corporation for National & Community Service, GO’s program of individualized tutoring & mentoring is currently provided by 300+ AmeriCorps members who are a part of the GO Fellowship at 6 different schools. The GO Foundation is seeking to expand its program by either (1) providing additional AmeriCorps members through an expanded grant at a larger number of partner schools, or; (2) providing technical assistance to school districts, or charter networks seeking to establish their own high-dosage tutoring/mentoring program.",Tutoring Program,,"New York, New York","Connecticut, Delaware, Maryland, New York",GreatOaksCharter.org,Nonprofit,2011,"English Language Arts (ELA), Math",,"Pre-Kindergarten, Kindergarten, 1st Grade, 2nd Grade, 3rd Grade, 4th Grade, 5th Grade, 6th Grade, 7th Grade, 8th Grade, 9th Grade, 10th Grade, 11th Grade, 12th Grade",Other,We recruit Fellows who have the language abilities to match our students and their families.,"Paraprofessional, Other",Paraprofessional Americorps Fellows,"Blended, In-Person, Virtual","We have no current data on linguistic capacity of our Tutors, but have significant numbers who have Spanish or Chinese language ability.","Hispanic or Latino- 18%, Asian 5%, Black or African American 35%, White 32%",3735,60,4,Throughout School Year,"2:1, 3:1, 4:1",,During School,,Tutors call home each week to check in with families about how their child is doing in school.,No,,,No,,,"District, School","$10,000 per Fellow placed, where the Great Oaks Foundation sources, screens, trains & supports the Fellow throughout their year of service, including paying the Fellow's living allowance.",Free,
TMS/Brown University K-12 Tutoring Initiative,Tutoring,Tutoring,"Brown University's online tutoring program is a free resource and service for all students of current partner K-12 schools offered through the Annenberg Institute, the Swearer Center and Tutor Matching Services. The Annenberg Institute's mission is rooted in conviction that improved educational equality leads to enriched opportunities for children and youth, ultimately contributing to more just and flourishing societies. Coupled with the Swearer Center's foundational components: community engagement, engaged scholarship, and social innovation, we strongly believe this program will have positive implications including higher graduation rates, higher rates of matriculation into a four-year university, higher grades on standardized testing, more positive attitude towards school and life, and higher self-esteem.","Tutoring Program, Other",Tutor Matching Service (Brown),"Providence, Rhode Island","Rhode Island, Virtual",https://tutormatchingservice.com/#/marketplace?school_name=Brown%20University%2…,Nonprofit,2020,"English Language Arts (ELA), Early Literacy, Math, Reading, Science, Social Studies, Other",All,"Pre-Kindergarten, Kindergarten, 1st Grade, 2nd Grade, 3rd Grade, 4th Grade, 5th Grade, 6th Grade, 7th Grade, 8th Grade, 9th Grade, 10th Grade, 11th Grade, 12th Grade","English, Spanish",,"Volunteer, Other",Brown University college students and graduates.,"In-Person, Virtual","95% English speakers, 5% Spanish",,,45-60,3,,1:01,,Out of School,,"Share flyers and information with schools, via parent list-servers, community organizations and social media.",No,,,No,,,"Parent, School, Student",Free,Free,
Tutor Corps,"Prioritize finding the perfect expert tutor to support your child, wherever they are in their educational journey.","Prioritize finding the perfect expert tutor to support your child, wherever they are in their educational journey.",Tutors work one-on-one with students in all grade levels to help them achieve their educational goals. We provide both remedial support for struggling students and enrichment for those who want to hone their skills.,Tutoring Program,,"Mill Valley, California",Virtual,www.tutorcorps.com,For Profit,2002,"English Language Arts (ELA), Early Literacy, Math, Reading, Science, Social Studies, Other",All,"Kindergarten, 1st Grade, 2nd Grade, 3rd Grade, 4th Grade, 5th Grade, 6th Grade, 7th Grade, 8th Grade, 9th Grade, 10th Grade, 11th Grade, 12th Grade",English,,"Paraprofessional, Teacher, Other",College graduates,"In-Person, Virtual",Varies,,,,Varies based on request,,1:01,,"During School, Out of School",,"Yes for initial consultation to see if tutoring is a good fit, and for additional scheduling and check in.",No,,,No,,,"District, Parent, School","Hourly fee of typically $140/hour if online, and $195/hour if in person.","Hourly fee of typically $140/hour if online, and $195/hour if in person.",
TutorChat,,"We are on a mission to make high-impact tutoring affordable for all families, regardless of income level, while giving high school students (our tutors) research-backed grit + growth mindset training that helps them develop and apply future-proof skills as volunteer tutors, and sets them up to stand out on their college applications.","Students in K-12 are paired with high school students who excel in math and English; they meet on a fixed weekly basis, with students meeting with the same tutor each time, ensuring that the student and tutor are able to build meaningful, high-impact relationships with one another. Prior to tutoring, tutors go through professional, research-based training on how to build grit and growth mindset skills in students while helping them with academics; they then apply these skills to their work as tutors and in doing so, gain true competency in coaching, communication and mindset development that they can use for the rest of their lives. Additionally, our tutors receive community service hours for their time and, thus, allow us to keep the fees for this high-quality, long-term personal tutoring accessible to families regardless of their income level.",Tutoring Program,,"Carlsbad, CA","California, Connecticut, Illinois, New York, North Carolina",https://www.tutorchat.org/,Nonprofit,2018,"English Language Arts (ELA), Math, Reading",,"Kindergarten, 1st Grade, 2nd Grade, 3rd Grade, 4th Grade, 5th Grade, 6th Grade, 7th Grade, 8th Grade, 9th Grade, 10th Grade, 11th Grade, 12th Grade",English,,"Peer, Volunteer",,Virtual,,"10% Hispanic or Latino, 69% Asian, 21% White",,45,,36,1:01,,Out of School,,"We provide families with feedback on sessions, handle scheduling requests and ensure that their goals for their children being tutored are met.",No,,,No,,,Parent,,$49/month,
