Title,Mission,Mission,Program Description,Type of service,Other type of service,"Headquarter Location (City, State)",States of Operation,Website Address,Organization Type,Year Started,Subject Offered,Other subjects,Grade Levels,Languages Offered,Other languages,Type of Tutor,Other tutor type,Delivery Mode,Percentage of tutors who can speak a language other than English,Race/Ethnicity breakdown of tutors,Most recent number of students served,Number of Minutes Per Session,Number of Sessions Per Week,Number of Weeks Per Program,Student-Tutor Ratio,Student/Tutor Ratio Per Program,Setting,Family Engagement,Family Engagement Description,Randomized controlled trial (RCT) study conducted?,RCT Citation,RCT effect size,Quasi-experimental (QED) study conducted?,QED citation,QED effect size,Customer Type,Cost to District/ School/ Non-Profit ,Cost to Student ,Contact
425 Tutoring,,"A free, student led, & community-driven group tutoring service to keep your student on track.","425 Tutoring is a student-run organization that connects high school volunteer tutors with elementary school students looking for tutoring. Based in Washington State, students and parents can sign up for group tutoring sessions on the website. We will then assign high school tutors to reach out and conduct recurring virtual tutoring sessions via Zoom or Google Meets. 
 ",Tutoring Program,,"Seattle, WA",Washington,http://425tutoring.org,Nonprofit,2020,"English Language Arts (ELA), Math, Reading",,"Kindergarten, 1st Grade, 2nd Grade, 3rd Grade, 4th Grade, 5th Grade, 6th Grade","English, Spanish",,"Peer, Volunteer",,Virtual,"5% speak Spanish, 5% speak Chinese","Hispanic or Latino- 10%, American Indian or Alaska Native-",673,40,1 to 2,8,3:01,,Out of School,,"Because our tutees are young, elementary school students, we rely on parent communication for scheduling and requesting student information. Tutors and parents communicate through email.",No,,,No,,,"Parent, School",0,0,
Air Tutors,To advance global learning by personalizing educational experiences with amazing educators.,To advance global learning by personalizing educational experiences with amazing educators.,Start-up virtual tutoring program with a credit recovery payment model.,Tutoring Program,,"Stockton, California","California, Michigan, Rhode Island, Texas",https://airtutors.org/,For Profit,2016,"English Language Arts (ELA), Early Literacy, Math, Reading, Science, Social Studies, Other",All,"Pre-Kindergarten, Kindergarten, 1st Grade, 2nd Grade, 3rd Grade, 4th Grade, 5th Grade, 6th Grade, 7th Grade, 8th Grade, 9th Grade, 10th Grade, 11th Grade, 12th Grade, Post secondary","Chinese, English, Spanish, Other","Hindi, Urdu, Punjabi, Mandarin, Cantonese, sign language",Paraprofessional,,Virtual,45% are multi-lingual,"Hispanic or Latino- 28%, Asian 11%, Black or African American 26%, White 32%",15000,,Varies,,1:1 up to 20:1,,"During School, Out of School",,,No,,,No,,,"District, Nonprofit, Parent, School, Student",District and corporate partnerships range depending on the tutoring program provided.,"Free for students who are enrolled in district sponsored program, per session cost for students who are self-enrolled.",
"Bass Educational Services, LLC",,Our mission is to provide students who learn differently with a range of educational services to support lifelong success. We offer a holistic and individualized tutoring approach to each students and their unique learning situation.,"Our tutors can assist with K-12 and postsecondary academic subject areas, homework support, distance learning strategies, coaching, and creating routines to help with time management and organization. The tutoring staff at BES understand the difficulties that students who learn differently face every day. With an in-depth knowledge of different learning styles and how to address them, our tutors can individualize their methods to meet each student's needs. Depending on your child's age and need, we have a dynamic approach to support learning. From multisensory math and emerging literacy through AP and IB courses, our tutors can support your family. ","Tutoring Program, Academic Intervention",,"Olney, Maryland","Florida, Maryland, New Jersey, New York, Virginia, Washington DC, Virtual",https://www.basseducationalservices.com,For Profit,2001,"English Language Arts (ELA), Early Literacy, Math, Reading, Science, Social Studies, Other",Organization and time management along with additional executive function/academic coaching skills.,"Kindergarten, 1st Grade, 2nd Grade, 3rd Grade, 4th Grade, 5th Grade, 6th Grade, 7th Grade, 8th Grade, 9th Grade, 10th Grade, 11th Grade, 12th Grade, Post secondary",English,,Tutoring Staff,,Virtual,,"10% Hispanic or Latino, 5% Asian, 10% Black or African American, 75% White",60,30-60,Varies by student needs,,1:01,,Out of School,,"We provide updates to the parents after every session including what was worked on, if there are any assignments to complete between sessions, and when the next session is. We also provide suggestions to parents regarding asking the child's teacher or school for accommodations and support.",No,,,No,,,"Parent, School, Student","30 min = $80; 45 min = $100; 60 min = $125 (but we are always flexible depending on the needs of the student, family and school)","30 min = $80; 45 min = $100; 60 min = $125 (but we are always flexible depending on the needs of the student, family and school)",
Blueprint Schools Network,,"Blueprint School Network promotes educational equity and improves life outcomes for students by partnering with states, districts, and schools to plan, implement, and monitor school improvement initiatives.",One-year fellowship placing tutors in Blueprint partner schools to provide in-school support.,Tutoring Program,,"Needham, Massachusetts","California, Colorado, Illinois",http://www.blueprintschools.org,Nonprofit,2010,Math,,"Pre-Kindergarten, Kindergarten, 1st Grade, 2nd Grade, 3rd Grade, 4th Grade, 5th Grade, 6th Grade, 7th Grade, 8th Grade, 9th Grade, 10th Grade, 11th Grade, 12th Grade",,,,,In-Person,,,,,"Daily, small-group",,Small group,,During School,,,No,,,No,,,School,,,"Founder and Executive Director, Matthew Spengler, info@blueprintschools.org"
BookNook,To ensure every child has access to a world-class reading teacher.,To ensure every child has access to a world-class reading teacher.,"BookNook provides a cloud-based platform for synchronous and rigorous K-8 reading instruction that can be accessed by any device larger than a phone. Students log in from school, home, or a community-based setting and work one-on-one or in small groups on algorithmically-recommended sequences of standards-aligned curricular and text content. Adult instructors are a diverse array of teachers, paraprofessionals, childcare providers, and community volunteers, and BookNook can also supply tutors from a national network of over 200,000 trained virtual instructors.","Tutoring Program, Technology Platform, Academic Intervention",,"San Francisco, California","California, Georgia, Illinois, Maryland, New York, Tennessee, Texas",https://www.booknooklearning.com/,For Profit,2016,Reading,,"Pre-Kindergarten, Kindergarten, 1st Grade, 2nd Grade, 3rd Grade, 4th Grade, 5th Grade, 6th Grade, 7th Grade, 8th Grade","English, Spanish",,"Paraprofessional, Teacher, Tutoring Staff, Volunteer",,"Blended, In-Person, Virtual","English-100%, Bilingual Spanish-20%",,75000,20-40,"Flexible, but 2-3 sessions per week are recommended.",,4:1 or 1:1,,"During School, Out of School",,,No,,,No,,,"District, Nonprofit, School","School districts & nonprofits pay $18-$40 per student per year for platform access, and $110-$1,100 per student per year for BookNook supplied tutors.",Free,
Bored of Boredom,,"We strive to bring education to everyone, especially those who have historically been excluded from enrichment opportunities, that’s why the majority of our students are neurodiverse, speak English as a second language, or come from under-resourced communities.",High school students providing indivdiual and group classes to ensure that children remain intellectually stimulated (for free) during this unprecendented time,"Tutoring Program, Other",,"Los Angeles, California",Virtual,https://www.boredofboredom.org/what-we-do,Nonprofit,2020,"English Language Arts (ELA), Early Literacy, Math, Reading, Science, Other","All (includes mutliple languages, free individual tutoring, and after-school study hall for homework help).","Pre-Kindergarten, Kindergarten, 1st Grade, 2nd Grade, 3rd Grade, 4th Grade, 5th Grade, 6th Grade, 7th Grade, 8th Grade, 9th Grade, 10th Grade, 11th Grade, 12th Grade","Chinese, English, Spanish",,Volunteer,,Virtual,,,,,Flexible,,"1:1, or 1:5-10",,Out of School,,,No,,,No,,,Student,,Free,"Hope Shinderman, President & Cofounder, boredofboredom20@gmail.com"
BrightPath Tutors,,"Level the playing field by providing free, outstanding tutoring to all students who need it.","Free, one-on-one online tutoring from qualified college students.","Tutoring Program, Other",,"Nashville, Tennessee","New York, Tennessee, Virtual",https://brightpathtutors.org/,Nonprofit,2020,"English Language Arts (ELA), Early Literacy, Math, Reading, Science, Other",College readiness,"Kindergarten, 1st Grade, 2nd Grade, 3rd Grade, 4th Grade, 5th Grade, 6th Grade, 7th Grade, 8th Grade, 9th Grade, 10th Grade, 11th Grade, 12th Grade",,,,,Virtual,,,,,Flexible,,1:01,,Out of School,,,No,,,No,,,"Parent, Student",,Free,contact@brightpathtutors.org
Brown Refugee Youth Tutoring and Enrichment (BRYTE),,"We support the self-empowerment of refugee youth through providing academic tutoring and mentoring, as well as by fostering a greater sense of community among students who share experiences of settlement in the United States.","BRYTE is a student-led organization that pairs Brown undergraduate tutors with students ages 5-18 in refugee families. Currently, BRYTE works with over 170 refugee youth that are resettled from a diverse set of countries, including Iraq, Syria, Colombia, Nepal, Eritrea, the Democratic Republic of the Congo, Rwanda, Burundi, Burma, Somalia, and others. Brown undergraduate, graduate, and medical school students serve as the tutors and mentors in the BRYTE program. Around 170 BRYTE volunteers work one-on-one with refugee students in their homes at least three hours per week. Volunteers spend time primarily tutoring (providing homework help and building on foundational literacy skills), but also engage in enrichment activities such as taking their students to visit the zoo, playing soccer at the park, or bringing them up to Brown's campus for community events.",Tutoring Program,,"Providence, Rhode Island",Rhode Island,https://brownrefugeetutoring.org/index.html,Nonprofit,2006,"English Language Arts (ELA), Early Literacy, Math, Reading, Science, Social Studies, Other",,"Kindergarten, 1st Grade, 2nd Grade, 3rd Grade, 4th Grade, 5th Grade, 6th Grade, 7th Grade, 8th Grade, 9th Grade, 10th Grade, 11th Grade, 12th Grade",,,Volunteer,,,,,,,,,1:01,,Out of School,,,No,,,No,,,"Parent, Student",,Free,
Burka Tutoring,,"To help students in grades K - 8 in reading, spelling, math, and executive functioning skills.   Specialty of Burka tutoring is working with students who are dyslexic.",Allee Burka is a licensed reading specialist who is an associate of Orton Gillingham and has her Masters in literacy. She provides one one one tutoring online and in person.,Tutoring Program,,"Bethesda, Maryland","Maryland, Virtual",,For Profit,2016,"English Language Arts (ELA), Early Literacy, Math, Reading",,"Pre-Kindergarten, Kindergarten, 1st Grade, 2nd Grade, 3rd Grade, 4th Grade, 5th Grade, 6th Grade, 7th Grade, 8th Grade, 9th Grade",,,Tutoring Staff,,Blended,,,15,45-60,3-Feb,Depends on student progress,1:01,,"During School, Out of School",,Weekly email updates and phone calls as requested.,No,,,No,,,Parent,,$75-100 per session,
Children's Learning Institute: Dan L. Duncan Reading Initiative,,The Dan L Duncan Programs at the Children's Learning Institute were created through the generosity of the Dan L Duncan family. Their mission is to enhance children's opportunities for successful living by providing them with individualized research-based clinical services. A highly unique aspect of our clinics is our focus on finding the most effective approaches for correcting child developmental and learning problems through a clinic structure that allows our research to inform our practice.,The Dan L Duncan Reading Initiative provides school-based early intervention to students who are at-risk for or who are experiencing reading failure as well as enrichment programs for students with grade level academic skills.,"Tutoring Program, Academic Intervention, Other",Offer school based tutoring programs.,"Houston, Texas",Texas,https://www.childrenslearninginstitute.org/programs/school-based-tutoring-progr…,,2007,"Reading, Other",Has another program for math.,"Kindergarten, 1st Grade, 2nd Grade, 3rd Grade, 4th Grade, 5th Grade","English, Spanish, Other",Spanish for K-2 only.,,,Virtual,,,,,4,,"1:1, small groups of up to 3 children",,,,,No,,,No,,,"School, Student",,,
Club Z In Home Tutoring Services,,We help students with school work and homework assignments. Our tutors go to students home and assist them.,We provide tutoring services for In home and Online tutoring services.,"Tutoring Program, Technology Platform, Academic Intervention",,"Buffalo Grove, Illinois",Illinois,https://clubztutoring.com/buffalo-grove/,For Profit,2019,"English Language Arts (ELA), Early Literacy, Math, Reading, Science, Social Studies, Other",,"Pre-Kindergarten, Kindergarten, 1st Grade, 2nd Grade, 3rd Grade, 4th Grade, 5th Grade, 6th Grade, 7th Grade, 8th Grade, 9th Grade, 10th Grade, 11th Grade, 12th Grade, Post secondary","English, Spanish",,"Parent, Peer, Teacher, Tutoring Staff",,Blended,10%,"20% Asian, 80% White",50,No limit,No limit,No limit,1:01,,Out of School,,Conversation with families.,No,,,No,,,"School, Student",,$45-50 per hour,
Connect Me,,Connect Me's mission is to give back and support our community as high school students with a passion for tutoring and mentoring!,"Connect Me provides free online tutoring and mentoring services to students who fit at least one of these criteria:
1) They are in a low income family (less than $60,000 yearly household income)
2) At least one parent/guardian of the student is an essential worker (as defined by the NCSL)
3) The student is in virtual/hybrid school due to the COVID-19 pandemic.
Students meet with their tutor at least once per week on a secured and monitored Zoom link, and have access to additional resources such as office hours.","Tutoring Program, Technology Platform",,"Novi, Michigan",Virtual,https://connectmego.org/,Nonprofit,2020,"English Language Arts (ELA), Early Literacy, Math, Reading, Science, Social Studies, Other","Time Management, Navigating Online Learning Platforms (e.g. Schoology)","Pre-Kindergarten, Kindergarten, 1st Grade, 2nd Grade, 3rd Grade, 4th Grade, 5th Grade, 6th Grade, 7th Grade, 8th Grade",English,,"Peer, Volunteer, Other",Retired teachers also comprise part of our tutors,Virtual,"30% are at least partially proficient in Spanish, 20% speak Hindi, 15% speak Turkish, 10% speak Arabic","1.4% Hispanic or Latino, 54.4% Asian, 10.3% Black or African American, 33.9% White",476,60,1,As many as student's family desires,1:01,,"During School, Out of School",,"We communicate with the student's family through email and phone to relay information about tutoring classes, such as the day/time and the Zoom link. Additionally, we also provide emails on organization updates and additional resources for students.",No,,,No,,,"Parent, Student",0,0,
Connect Tutors,,Connect Tutors supports equitable access to college through free and remote application essay tutoring.,"Connect Tutors is a remote tutoring program providing high school students with free and high-quality college application essay support. We pair predominantly low-income students with our team of tutors, and equip them to build meaningful mentorship relationships that develop the writing skills and confidence of high school students. We believe a student's financial circumstances should play no role in their ability to access college writing support and tell their stories effectively.",Tutoring Program,,"Boston, MA","Massachusetts, Rhode Island, Virtual",https://www.connecttutors.org/,Nonprofit,2020,Other,College essay,"11th Grade, 12th Grade","English, French, Spanish, Other",,"Tutoring Staff, Volunteer",,Virtual,25% speak Spanish,,,90,1,8,,,"During School, Out of School",,,No,,,No,,,District,,,
CovEducation,,"With an expanding community of 5,000+ undergraduates, postgraduates and educators from 448 higher education institutions and 4,000+ mentees across 50 states, CovEd believes in the democratization of academic resources and support so that every student has a chance to reach their fullest potential. This program is available to all K-12 students in the U.S., focusing on those with limited access to resources for continued learning especially during the COVID-19 pandemic.","CovEducation is a 501(c)(3) non-profit that works to connect mentors from higher education institutions with K-12 students affected by school closures. Our mentors not only serve as academic tutors but also as role models who foster non-academic interests and career exploration. We also compile free, web-based educational resources for students, families, and educators, as well as partner with schools and other non-profits to improve the learning experience of K-12 students.","Tutoring Program, Academic Intervention",,,Virtual,https://www.coved.org/,Nonprofit,2020,"English Language Arts (ELA), Early Literacy, Math, Reading, Science, Social Studies, Other","Writing, History, Computer Science, Economics, Music, Art, Language, K-12 Test Prep","Kindergarten, 1st Grade, 2nd Grade, 3rd Grade, 4th Grade, 5th Grade, 6th Grade, 7th Grade, 8th Grade, 9th Grade, 10th Grade, 11th Grade, 12th Grade","Chinese, English, French, Spanish, Vietnamese, Other",Depends on mentor availability,Volunteer,,Virtual,,,5000,60 or more,1 or more,Depends on mentorship pairs,1:01,,"During School, Out of School",,"If under 18 years old, we require that a parent or guardian be present during all mentoring sessions.",No,,,No,,,"Parent, School, Student",Free,Free,
EdLight,,EdLight helps align tutoring with the school curriculum and allows teachers to oversee the quality of tutoring.,"EdLight is a platform to organize student work. Using EdLight's tutoring features, teachers can assign students to tutoring, specifying the standards / content for tutoring, and sharing any classwork / data that will allow the tutor to target their support. Tutors then share student work from each session back with teachers, allowing teachers to ensure that the tutoring is aligned to classwork and high quality. This intimate communication between teachers and tutors builds trust and allows teachers to confidently focus on grade level work during core instruction time.","Tutoring Program, Technology Platform",,"Boston, MA",Virtual,https://www.edlight.com/,For Profit,2021,"English Language Arts (ELA), Early Literacy, Math, Reading",,"Kindergarten, 1st Grade, 2nd Grade, 3rd Grade, 4th Grade, 5th Grade, 6th Grade, 7th Grade, 8th Grade",English,,"Teacher, Tutoring Staff",,Virtual,,"50% Black or African American, 50% White",,30,4,6,1:1 - 6:1,,"During School, Out of School",,,No,,,No,,,"District, School","Tutoring platform --> $5 / student, Tutoring services --> $960 per group of up to 6 students ($160 - $960 per student)",$0 ,
Empower CNY,,"Empower CNY began as a way to improve educational equity in Central New York. Many young students have fallen behind due to disproportionate resource allocation within our education system. To help students combat this issue, Empower CNY links high school volunteers with them locally. Tutors not only enjoy developing the community but also have the opportunity to build interpersonal and leadership qualities. Through diverse student leadership, Empower CNY is able to develop activities and programs that meet the needs of all ambitious students. At Empower CNY, we strive to provide the resources for all students to reach their maximum academic potential.",High school tutors from across the Central New York area register through our website and are firstly interviewed. They are then paired with a student who is in need of tutoring. We hold tutoring sessions weekly on Saturday and Sunday at morning and evening times. Parents and tutors provide feedback through our optional session review forms.,"Tutoring Program, Technology Platform, Academic Intervention, Other",Workshops,"Syracuse, New York","New York, Virtual",http://empowercny.org,Nonprofit,2020,"English Language Arts (ELA), Early Literacy, Math, Reading, Science, Social Studies, Other",Foreign Languages,"Kindergarten, 1st Grade, 2nd Grade, 3rd Grade, 4th Grade, 5th Grade, 6th Grade, 7th Grade, 8th Grade",English,,"Volunteer, Other",High School Students,Virtual,,"1% Hispanic or Latino,",20,60,3,Infinite,1:01,,Out of School,,"Discussions with parents over email regarding student preparation, session review forms to gauge satisfaction.",No,,,No,,,"Parent, School, Student",$0 ,$0 ,
eTutorWorld Corporation,,"Founded in 2008, we realized tutoring could be made more affordable and convenient, without compromising on the quality of education provided to students. Our goal is to support parents and offer what each child needs to be successful as an individual, in a welcoming and supportive community.","eTutorWorld offers one-to-one, and small group, online tutoring in math, science, English, and test prep for students in grades K-12. Tutors are carefully selected subject matter experts with college degree, often Masters, teaching experience, and go through extensive tutor training with ongoing coaching. Students are thoughtfully matched with a dedicated tutor for optimal personalized learning experience and mentoring relationship. Customized curriculum based on school and state standards, regular diagnostic assessments and Learn by Design teaching methodology to track progress. All sessions recorded and available for review. Sophisticated technology platform to manage large scale tutoring programs, currently delivering 2000 lessons per month. Flexible packages based on student needs. Now partnering with schools and districts to support high-impact tutoring initiatives.","Tutoring Program, Technology Platform",,"East Lansing, Michigan","Alabama, Alaska, Arizona, Arkansas, California, Colorado, Connecticut, Delaware, Florida, Georgia, Hawaii, Idaho, Illinois, Indiana, Iowa, Kansas, Kentucky, Louisiana, Maine, Maryland, Massachusetts, Michigan, Minnesota, Mississippi, Missouri, Montana, Nebraska, Nevada, New Hampshire, New Jersey, New Mexico, New York, North Carolina, North Dakota, Ohio, Oklahoma, Oregon, Pennsylvania, Rhode Island, South Carolina, South Dakota, Tennessee, Texas, Utah, Vermont, Virginia, Washington, Washington DC, West Virginia, Wisconsin, Wyoming, Virtual",https://www.etutorworld.com,For Profit,2008,"English Language Arts (ELA), Early Literacy, Math, Reading, Science, Social Studies, Other","Test prep: AP, ACT, SAT, PSAT, SCAT, SSAT, ISEE, CogAT","Kindergarten, 1st Grade, 2nd Grade, 3rd Grade, 4th Grade, 5th Grade, 6th Grade, 7th Grade, 8th Grade, 9th Grade, 10th Grade, 11th Grade, 12th Grade",English,,"Teacher, Tutoring Staff",,Virtual,,"95% Asian, 5% Black or African American",2000,60,"1-5, Customizable",Customizable,1:1 - 4:1,,"During School, Out of School",,"Virtual meeting with parent to discuss goals and develop learning plan, copied on all emails for scheduled sessions, access to student portal to track learning progress and attendance, schedule sessions, view recorded lessons and assigned worksheets to do between lessons, regular check-ins with parents available, 24x7 customer support, dedicated tutors become mentors and work with parents to optimize student learning.",No,,,No,,,"District, Nonprofit, Parent, School, Student",Varies,$19-$26 per 1:1 session (one hour),
General Tutoring,,General Tutoring aims to alleviate educational inequalities through free supplemental tutoring for students in the greater Waltham area.,GT matches Brandeis students with Waltham public school students (K-12) for free 1 on 1 tutoring in any academic subject on campus,Tutoring Program,,"Waltham, MA",Massachusetts,https://www.brandeis.edu/community-service/waltham-group/programs/general-tutor…,Nonprofit,,"English Language Arts (ELA), Early Literacy, Math, Reading, Science, Other",All,"Kindergarten, 1st Grade, 2nd Grade, 3rd Grade, 4th Grade, 5th Grade, 6th Grade, 7th Grade, 8th Grade, 9th Grade, 10th Grade, 11th Grade, 12th Grade","English, Spanish",,"Volunteer, College Students",,"Blended, In-Person, Virtual","32% - None, 10% - Spanish, 7% - Mandarin Chinese, 8% - Hebrew, 6%- French,",,141,60,1,30,1:01,,Out of School,,Communicates over phone or email with parents.,No,,,No,,,School,$50 per tutor,Free,
